term,crn,catalog_id,section,credits,title,meetings,timecodes,primary_instructor,instructors,cap,act,rem
SummerII2019,79008,AC 0204,01,3.000,Intermediate Accounting II,"[{'days': 'M', 'times': '0600pm-0945pm', 'dates': '07/01-07/01', 'location': 'DSB 104'}, {'days': 'MW', 'times': '0600pm-0945pm', 'dates': '07/08-07/31', 'location': 'DSB 104'}, {'days': 'T', 'times': '0600pm-0945pm', 'dates': '07/30-07/30', 'location': 'DSB 104'}]","['M 0600pm-0945pm 07/01-07/01 DSB 104', 'MW 0600pm-0945pm 07/08-07/31 DSB 104', 'MW 0600pm-0945pm 07/08-07/31 DSB 104', 'T 0600pm-0945pm 07/30-07/30 DSB 104', 'T 0600pm-0945pm 07/30-07/30 DSB 104']",Scott M  Brenner,Scott M  Brenner (P),25,7,18
SummerII2019,79039,AC 0400,OL1,3.000,Introduction to Accounting,"[{'days': 'TW', 'times': '0630pm-0930pm', 'dates': '07/24-07/30', 'location': 'ONLINE '}]","['TW 0630pm-0930pm 07/24-07/30 ONLINE ', 'TW 0630pm-0930pm 07/24-07/30 ONLINE ']",Michael P.  Coyne,Michael P.  Coyne (P),20,9,11
SummerII2019,79085,AS 0406,01,3.000,"Power, Politics, and Institutions in the United States","[{'days': 'TWR', 'times': '0500pm-0900pm', 'dates': '07/09-07/23', 'location': 'MCA 102'}, {'days': 'S', 'times': '0930am-0130pm', 'dates': '07/13-07/20', 'location': 'MCA 102'}]","['TWR 0500pm-0900pm 07/09-07/23 MCA 102', 'S 0930am-0130pm 07/13-07/20 MCA 102', 'S 0930am-0130pm 07/13-07/20 MCA 102']",Gwendoline M.  Alphonso,Gwendoline M.  Alphonso (P),15,6,9
SummerII2019,79011,AY 0110,OL1,3.000,Biological Anthropology,[],[],Joseph A.  Wilson,Joseph A.  Wilson (P),20,18,2
SummerII2019,79076,AY 0110,OL2,3.000,Biological Anthropology,[],[],Sarah A.  Wessler,Sarah A.  Wessler (P),20,22,-2
SummerII2019,79009,AE 0291,OL1,3.000,Business Ethics,[],[],Lisa M.  Sticca-Conrod,Lisa M.  Sticca-Conrod (P),20,12,8
SummerII2019,79010,AH 0011,OL1,3.000,Visual Culture Since 1400: Expression and Experimentation,[],[],Lauren Elise  Cesiro,Lauren Elise  Cesiro (P),20,16,4
SummerII2019,79012,BI 0070,OL1,3.000,"Science, Technology, and Society",[],[],Debra S.  Sauer,Debra S.  Sauer (P),20,12,8
SummerII2019,79013,BI 0071,01,3.000,Identity and the Human Genome,"[{'days': 'MTWRF', 'times': '0930am-1230pm', 'dates': '07/08-07/19', 'location': 'NHS 411'}]",['MTWRF 0930am-1230pm 07/08-07/19 NHS 411'],Olivia T.  Harriott,Olivia T.  Harriott (P),13,4,9
SummerII2019,79014,BI 0071,01S,3.000,Identity and the Human Genome,"[{'days': 'MTWRF', 'times': '0930am-1230pm', 'dates': '07/08-07/19', 'location': 'NHS 411'}]",['MTWRF 0930am-1230pm 07/08-07/19 NHS 411'],Olivia T.  Harriott,Olivia T.  Harriott (P),7,4,3
SummerII2019,79099,BI 0076,OL1,3.000,Environmental Science,[],[],James E.  Biardi,James E.  Biardi (P),20,16,4
SummerII2019,79089,BI 0088,AI1,3.000,Biomedical Science and Society,"[{'days': 'MTWRF', 'times': '0900am-1100am', 'dates': '08/05-08/30', 'location': 'NHS 210'}]",['MTWRF 0900am-1100am 08/05-08/30 NHS 210'],Jillian E.  Smith-Carpenter,Jillian E.  Smith-Carpenter (P),25,14,11
SummerII2019,79090,BI 0088,AI2,3.000,Biomedical Science and Society,"[{'days': 'MTWRF', 'times': '0100pm-0300pm', 'dates': '08/05-08/30', 'location': 'NHS 210'}]",['MTWRF 0100pm-0300pm 08/05-08/30 NHS 210'],Jillian E.  Smith-Carpenter,Jillian E.  Smith-Carpenter (P),25,14,11
SummerII2019,79015,BI 0108,01,4.000,Human Anatomy and Physiology II,"[{'days': 'MTWR', 'times': '0800am-1000am', 'dates': '07/08-08/09', 'location': 'BNW 129B'}]",['MTWR 0800am-1000am 07/08-08/09 BNW 129B'],Anthony J.  DeCristofaro,Anthony J.  DeCristofaro (P),16,10,6
SummerII2019,79016,BI 0108L,01,0.000,Human Anatomy and Physiology Lab II,"[{'days': 'TR', 'times': '1005am-1255pm', 'dates': '07/08-08/09', 'location': 'BNW 264'}]",['TR 1005am-1255pm 07/08-08/09 BNW 264'],Anthony J.  DeCristofaro,Anthony J.  DeCristofaro (P),16,10,6
SummerII2019,79074,CH 0112,01,3.000,General Chemistry II,"[{'days': 'MTWRF', 'times': '0800am-1000am', 'dates': '07/08-08/09', 'location': 'DMH 349'}]",['MTWRF 0800am-1000am 07/08-08/09 DMH 349'],Jon J.  Harper,Jon J.  Harper (P),16,12,4
SummerII2019,79075,CH 0112L,01,1.000,General Chemistry II Lab,"[{'days': 'TWR', 'times': '1030am-0130pm', 'dates': '07/08-08/09', 'location': 'BNW 362'}]",['TWR 1030am-0130pm 07/08-08/09 BNW 362'],Jon J.  Harper,Jon J.  Harper (P),16,14,2
SummerII2019,79081,CH 0212,01,3.000,Organic Chemistry II,"[{'days': 'MTWRF', 'times': '0800am-1000am', 'dates': '07/08-08/09', 'location': 'DMH 350'}]",['MTWRF 0800am-1000am 07/08-08/09 DMH 350'],Donald J.  Wolanin,Donald J.  Wolanin (P),16,9,7
SummerII2019,79084,CH 0212L,01,1.000,Organic Chemistry II Lab,"[{'days': 'TWR', 'times': '1130am-0330pm', 'dates': '07/08-08/09', 'location': 'BNW 339'}]",['TWR 1130am-0330pm 07/08-08/09 BNW 339'],Omari   Ansong,Omari   Ansong (P),16,9,7
SummerII2019,79017,CO 0200,OL1,3.000,Interpersonal Communication Theories,[],[],Michael P.  Pagano,Michael P.  Pagano (P),20,9,11
SummerII2019,79066,CO 0430,01,3.000,Written Communication,"[{'days': 'R', 'times': '0630pm-0900pm', 'dates': '07/11-07/25', 'location': 'NHS 203'}]",['R 0630pm-0900pm 07/11-07/25 NHS 203'],Michael P.  Pagano,Michael P.  Pagano (P),20,17,3
SummerII2019,79040,CN 0465,01,3.000,Introduction to Substance Abuse and Addictions,"[{'days': 'TR', 'times': '0430pm-0830pm', 'dates': '07/09-08/01', 'location': 'DMH 347'}]",['TR 0430pm-0830pm 07/09-08/01 DMH 347'],Joseph A.  Graziano,Joseph A.  Graziano (P),15,18,-3
SummerII2019,79018,EC 0011,01,3.000,Introduction to Microeconomics,"[{'days': 'MTWRF', 'times': '0930am-1230pm', 'dates': '07/08-07/19', 'location': 'MCA 107'}]",['MTWRF 0930am-1230pm 07/08-07/19 MCA 107'],Philip J.  Lane,Philip J.  Lane (P),13,3,10
SummerII2019,79019,EC 0011,01S,3.000,Introduction to Microeconomics,"[{'days': 'MTWRF', 'times': '0930am-1230pm', 'dates': '07/08-07/19', 'location': 'MCA 107'}]",['MTWRF 0930am-1230pm 07/08-07/19 MCA 107'],Philip J.  Lane,Philip J.  Lane (P),7,3,4
SummerII2019,79020,EC 0011,02,3.000,Introduction to Microeconomics,"[{'days': 'MTWR', 'times': '0645pm-0845pm', 'dates': '07/08-08/09', 'location': 'MCA 206'}]",['MTWR 0645pm-0845pm 07/08-08/09 MCA 206'],Mark S.  Leclair,Mark S.  Leclair (P),25,7,18
SummerII2019,79021,EC 0012,OL1,3.000,Introduction to Macroeconomics,[],[],William F.  Vasquez Mazariegos,William F.  Vasquez Mazariegos (P),20,10,10
SummerII2019,79022,EC 0140,OL1,3.000,Health Economics,[],[],Anna-Maria   Aksan,Anna-Maria   Aksan (P),20,10,10
SummerII2019,79042,ED 0405,01,3.000,Contexts of Education in the Primary Grades,"[{'days': 'MW', 'times': '0400pm-0800pm', 'dates': '07/08-07/31', 'location': 'DMH 348'}]",['MW 0400pm-0800pm 07/08-07/31 DMH 348'],Claudia Schwarz  Wolen,Claudia Schwarz  Wolen (P),20,15,5
SummerII2019,79086,ED 0511,01,3.000,Educating for Social Responsibility and Civic Engagement: A Capstone Seminar,"[{'days': 'MW', 'times': '1000am-0230pm', 'dates': '07/08-07/31', 'location': 'DMH 349'}]",['MW 1000am-0230pm 07/08-07/31 DMH 349'],Pierre W.  Orelus,Pierre W.  Orelus (P),18,16,2
SummerII2019,79087,ED 0511,02,3.000,Educating for Social Responsibility and Civic Engagement: A Capstone Seminar,"[{'days': 'TR', 'times': '0400pm-0830pm', 'dates': '07/09-08/01', 'location': 'DSB 105'}]",['TR 0400pm-0830pm 07/09-08/01 DSB 105'],Terri L.  Germain-Williams,Terri L.  Germain-Williams (P),18,21,-3
SummerII2019,79088,ED 0511,03,3.000,Educating for Social Responsibility and Civic Engagement: A Capstone Seminar,"[{'days': 'MW', 'times': '1000am-0230pm', 'dates': '07/08-07/31', 'location': 'DSB 2109A'}]",['MW 1000am-0230pm 07/08-07/31 DSB 2109A'],Terri L.  Germain-Williams,Terri L.  Germain-Williams (P),17,10,7
SummerII2019,79043,ED 0534,01,3.000,Theories of Learning,"[{'days': 'MW', 'times': '0430pm-0815pm', 'dates': '07/01-08/09', 'location': 'DMH 349'}]",['MW 0430pm-0815pm 07/01-08/09 DMH 349'],Deborah L.  Edelman,Deborah L.  Edelman (P),5,3,2
SummerII2019,79044,ED 0561,01,3.000,Summer Institute in the Teaching of Writing,"[{'days': 'TWR', 'times': '0900am-0300pm', 'dates': '07/01-08/09', 'location': 'DMH 348'}]",['TWR 0900am-0300pm 07/01-08/09 DMH 348'],Bryan R.  Crandall,Bryan R.  Crandall (P),20,20,0
SummerII2019,79097,ED 0599,01,3.000,Professional Writing Seminar: Product of Learning,"[{'days': 'MW', 'times': '1000am-0230pm', 'dates': '07/08-07/29', 'location': 'MCA 204'}]",['MW 1000am-0230pm 07/08-07/29 MCA 204'],Steven R.  LeMay,Steven R.  LeMay (P),20,3,17
SummerII2019,79049,MD 0401H,OL1,3.000,Special Topics: Introduction to Open Educational Resources,[],[],Kevin   Corcoran,Kevin   Corcoran (P),20,11,9
SummerII2019,79050,MD 0465,01,3.000,Emerging Technologies: Building and Publishing Online Books,"[{'days': 'MTWRF', 'times': '0900am-0300pm', 'dates': '07/08-07/12', 'location': 'NHS 210'}]",['MTWRF 0900am-0300pm 07/08-07/12 NHS 210'],Jay L.  Rozgonyi,Jay L.  Rozgonyi (P),20,6,14
SummerII2019,79051,MD 0465,02,3.000,Emerging Technologies,"[{'days': 'MTWRF', 'times': '0900am-0300pm', 'dates': '07/22-07/26', 'location': 'NHS 210'}]",['MTWRF 0900am-0300pm 07/22-07/26 NHS 210'],Joshua C.  Elliott,Joshua C.  Elliott (P),20,10,10
SummerII2019,79024,EN 0102,OL1,3.000,Introduction to Contemporary World Literature,[],[],Sally E.  O'Driscoll,Sally E.  O'Driscoll (P),20,17,3
SummerII2019,79025,EN 0163,OL1,3.000,The Literature of Illness and Healing: Wounded Storytellers and Dedicated Healers,[],[],Jacqueline   Rinaldi,Jacqueline   Rinaldi (P),20,17,3
SummerII2019,79045,EN 0405,01,3.000,Literature for Young Adults,"[{'days': 'TR', 'times': '1000am-0230pm', 'dates': '07/01-08/09', 'location': 'DMH 349'}]",['TR 1000am-0230pm 07/01-08/09 DMH 349'],Mary Elizabeth  Nelson,Mary Elizabeth  Nelson (P),20,5,15
SummerII2019,79026,FI 0101,OL1,3.000,Introduction to Finance,[],[],Walter F.  Hlawitschka,Walter F.  Hlawitschka (P),20,14,6
SummerII2019,79002,FI 0400,OL1,3.000,Principles of Finance,"[{'days': 'MTWRF', 'times': '0600pm-1000pm', 'dates': '07/26-08/02', 'location': 'ONLINE '}, {'days': 'S', 'times': '0830am-0430pm', 'dates': '07/27-08/03', 'location': 'ONLINE '}]","['MTWRF 0600pm-1000pm 07/26-08/02 ONLINE ', 'S 0830am-0430pm 07/27-08/03 ONLINE ', 'S 0830am-0430pm 07/27-08/03 ONLINE ']",Thomas E.  Conine,Thomas E.  Conine (P),18,7,11
SummerII2019,79003,FI 0580,OL1,3.000,Financial Risk Management,[],[],Nazli S.  Alan,Nazli S.  Alan (P),25,15,10
SummerII2019,79083,IT 0220,OL1,3.000,Topics in Language and Culture,[],[],David J.  Lara,David J.  Lara (P),20,4,16
SummerII2019,79004,MK 0241,OL1,3.000,Digital Marketing,[],[],Camelia   Micu,Camelia   Micu (P),25,23,2
SummerII2019,79006,MK 0400,OL1,3.000,Marketing Management,[],[],Gerald O.  Cavallo,Gerald O.  Cavallo (P),25,6,19
SummerII2019,79007,MK 0580,OL1,3.000,Multivariate Data Analysis for Decision Making,[],[],Rajasree   Krishnankutty NairRajamma,"Rajasree   Krishnankutty NairRajamma (P), Mark S.  Ligas , Camelia   Micu , Iman   Naderi , Michael R.  Sciandra ",20,21,-1
SummerII2019,79046,FT 0465,01,3.000,Introduction to Substance Abuse and Addictions,"[{'days': 'TR', 'times': '0430pm-0830pm', 'dates': '07/09-08/01', 'location': 'DMH 347'}]",['TR 0430pm-0830pm 07/09-08/01 DMH 347'],Joseph A.  Graziano,Joseph A.  Graziano (P),7,3,4
SummerII2019,79027,MA 0120,01,3.000,Applied Calculus II,"[{'days': 'MTWR', 'times': '1030am-1230pm', 'dates': '07/08-08/09', 'location': 'MCA 102'}]",['MTWR 1030am-1230pm 07/08-08/09 MCA 102'],Edward T.  Giegengack,Edward T.  Giegengack (P),25,6,19
SummerII2019,79093,MA 0565,01,3.000,Use of Technology in the Classroom,"[{'days': 'MW', 'times': '0630pm-0930pm', 'dates': '07/01-08/09', 'location': 'NHS 210'}]",['MW 0630pm-0930pm 07/01-08/09 NHS 210'],Jessica C.  Pfeil,Jessica C.  Pfeil (P),15,5,10
SummerII2019,79028,MU 0104,OL1,3.000,History of Music: 1700-1964,[],[],Michael Anthony  Ciavaglia,Michael Anthony  Ciavaglia (P),20,19,1
SummerII2019,79001,OM 0101,OL1,3.000,Operations Management,[],[],Xin Xin   He,Xin Xin   He (P),20,4,16
SummerII2019,79095,OM 0400,01,3.000,Business Operations,"[{'days': 'MR', 'times': '0600pm-0930pm', 'dates': '07/01-08/09', 'location': 'DSB 107'}]",['MR 0600pm-0930pm 07/01-08/09 DSB 107'],Patrick S.  Lee,Patrick S.  Lee (P),20,6,14
SummerII2019,79091,PH 0101,AI1,3.000,Introduction to Philosophy,"[{'days': 'MTWRF', 'times': '0900am-1100am', 'dates': '08/05-08/30', 'location': 'DMH 347'}]",['MTWRF 0900am-1100am 08/05-08/30 DMH 347'],Kris F.  Sealey,Kris F.  Sealey (P),25,14,11
SummerII2019,79092,PH 0101,AI2,3.000,Introduction to Philosophy,"[{'days': 'MTWRF', 'times': '0100pm-0300pm', 'dates': '08/05-08/30', 'location': 'DMH 347'}]",['MTWRF 0100pm-0300pm 08/05-08/30 DMH 347'],Dennis K.  Keenan,Dennis K.  Keenan (P),25,14,11
SummerII2019,79038,PH 0250,01,3.000,Ethical Theory,"[{'days': 'MTWR', 'times': '0645pm-0845pm', 'dates': '07/08-08/09', 'location': 'MCA 204'}]",['MTWR 0645pm-0845pm 07/08-08/09 MCA 204'],James Abordo   Ong,James Abordo   Ong (P),25,7,18
SummerII2019,79030,PS 0116,01,3.000,General Physics II,"[{'days': 'MTWR', 'times': '0800am-1000am', 'dates': '07/08-08/09', 'location': 'NHS 224'}]",['MTWR 0800am-1000am 07/08-08/09 NHS 224'],Bidyut B.  Das,Bidyut B.  Das (P),25,22,3
SummerII2019,79031,PS 0116L,01,1.000,General Physics II Lab,"[{'days': 'MTWR', 'times': '1030am-1230pm', 'dates': '07/08-08/09', 'location': 'BNW 162'}]",['MTWR 1030am-1230pm 07/08-08/09 BNW 162'],Bidyut B.  Das,Bidyut B.  Das (P),25,19,6
SummerII2019,79029,PO 0276,OL1,3.000,United States Foreign Policy,[],[],Lucrecia   Garcia Iommi,Lucrecia   Garcia Iommi (P),20,4,16
SummerII2019,79032,PY 0101,01,3.000,General Psychology,"[{'days': 'MTWRF', 'times': '0930am-1230pm', 'dates': '07/08-07/19', 'location': 'LNG 109'}]",['MTWRF 0930am-1230pm 07/08-07/19 LNG 109'],Michael Walden  Creane,Michael Walden  Creane (P),13,10,3
SummerII2019,79033,PY 0101,01S,3.000,General Psychology,"[{'days': 'MTWRF', 'times': '0930am-1230pm', 'dates': '07/08-07/19', 'location': 'LNG 109'}]",['MTWRF 0930am-1230pm 07/08-07/19 LNG 109'],Michael Walden  Creane,Michael Walden  Creane (P),7,6,1
SummerII2019,79052,PY 0534,01,3.000,Theories of Learning,"[{'days': 'MW', 'times': '0430pm-0815pm', 'dates': '07/01-08/09', 'location': 'DMH 349'}]",['MW 0430pm-0815pm 07/01-08/09 DMH 349'],Deborah L.  Edelman,Deborah L.  Edelman (P),13,13,0
SummerII2019,79094,MPA 0415,OL1,3.000,Human Resource Management,[],[],Gayle A.  Alberda,Gayle A.  Alberda (P),15,10,5
SummerII2019,79096,QA 0400,OL1,3.000,Applied Business Statistics,[],[],Xin Xin   He,Xin Xin   He (P),20,4,16
SummerII2019,79100,RLD 0575,OL1,1.000,Developmental Literacy Remediation for Students in Grades 3+,[],[],Jule J.  McCombes-Tolis,Jule J.  McCombes-Tolis (P),20,7,13
SummerII2019,79053,RLD 0585,01,3.000,Writing Components and Processes in the Language Arts Program,"[{'days': 'MTWR', 'times': '0430pm-0830pm', 'dates': '07/15-07/25', 'location': 'MCA 107'}]",['MTWR 0430pm-0830pm 07/15-07/25 MCA 107'],Jennifer C.  Hornyak,Jennifer C.  Hornyak (P),20,12,8
SummerII2019,79054,RLD 0587,01,3.000,Practicum in Tier II Reading and Language Arts Intervention Practices,[],[],Jule J.  McCombes-Tolis,Jule J.  McCombes-Tolis (P),12,14,-2
SummerII2019,79055,RLD 0588,01,3.000,Practicum in Tier III Reading and Language Arts Intervention Practices,[],[],Jule J.  McCombes-Tolis,Jule J.  McCombes-Tolis (P),12,18,-6
SummerII2019,79056,RLD 0588,02,3.000,Practicum in Tier III Reading and Language Arts Intervention Practices,[],[],Jule J.  McCombes-Tolis,Jule J.  McCombes-Tolis (P),12,3,9
SummerII2019,79072,RS 0101C,01,3.000,"Exploring Religion: Common Questions, Traditional Response","[{'days': 'MTWR', 'times': '0800am-1000am', 'dates': '07/08-08/09', 'location': 'MCA 206'}]",['MTWR 0800am-1000am 07/08-08/09 MCA 206'],John T.  Slotemaker,John T.  Slotemaker (P),25,14,11
SummerII2019,79034,RS 0252,OL1,3.000,Contemporary Moral Problems,[],[],Christian   Cintron,Christian   Cintron (P),20,20,0
SummerII2019,79036,SP 0111,01,3.000,Elementary Spanish II,"[{'days': 'MTWR', 'times': '1030am-1230pm', 'dates': '07/08-08/09', 'location': 'MCA 206'}]",['MTWR 1030am-1230pm 07/08-08/09 MCA 206'],Ana C.  DeLuca,Ana C.  DeLuca (P),25,4,21
SummerII2019,79037,SP 0211,01,3.000,Intermediate Spanish II,"[{'days': 'MTWR', 'times': '0100pm-0300pm', 'dates': '07/08-08/09', 'location': 'MCA 206'}]",['MTWR 0100pm-0300pm 07/08-08/09 MCA 206'],Ana C.  DeLuca,Ana C.  DeLuca (P),25,5,20
SummerII2019,79058,SE 0400,01,3.000,Augmentative Alternative Communications and Assistive Technologies,"[{'days': 'TR', 'times': '0445pm-0730pm', 'dates': '07/01-08/09', 'location': 'DMH 350'}]",['TR 0445pm-0730pm 07/01-08/09 DMH 350'],Vittoria   Fielosh,Vittoria   Fielosh (P),20,9,11
SummerII2019,79059,SE 0486,01,3.000,Developmental Literacy I: Fundamentals of Reading and Language Development,"[{'days': 'MW', 'times': '0430pm-0730pm', 'dates': '07/01-08/09', 'location': 'DMH 347'}]",['MW 0430pm-0730pm 07/01-08/09 DMH 347'],Jonathan Michael  Cop,Jonathan Michael  Cop (P),20,12,8
SummerII2019,79101,SE 0575,OL1,1.000,Developmental Literacy Remediation for Students in Grades 3+,[],[],Jule J.  McCombes-Tolis,Jule J.  McCombes-Tolis (P),20,0,20
SummerII2019,79060,SE 0591,01,3.000,Practica in Special Education,[],[],Wendy   Sobelman,Wendy   Sobelman (P),6,2,4
SummerII2019,79078,SHS 0011,01,0.000,Arts and Sciences Pre-College: Nutrition and Global Food Security,"[{'days': 'MTWRF', 'times': '0900am-0400pm', 'dates': '07/08-07/12', 'location': 'DMH 131'}]",['MTWRF 0900am-0400pm 07/08-07/12 DMH 131'],Aaron R.  Van Dyke,Aaron R.  Van Dyke (P),15,8,7
SummerII2019,79080,SHS 0013,01,0.000,Nursing: The Possibilities Are Endless,"[{'days': 'MTWRF', 'times': '0900am-0400pm', 'dates': '07/08-07/12', 'location': 'NHS 103'}]",['MTWRF 0900am-0400pm 07/08-07/12 NHS 103'],Laura A.  Conklin,Laura A.  Conklin (P),25,25,0
SummerII2019,79077,SHS 0090,01,0.000,Summer BASE Camp,[],[],Christine R.  Rodriguez,Christine R.  Rodriguez (P),24,21,3
SummerII2019,79063,SL 0422,01,3.000,Teaching Grammar in Second Language Settings,"[{'days': 'TR', 'times': '0430pm-0830pm', 'dates': '07/09-08/01', 'location': 'DMH 131'}]",['TR 0430pm-0830pm 07/09-08/01 DMH 131'],Linda A.  Chehy,Linda A.  Chehy (P),20,14,6
SummerII2019,79065,SL 0522,01,3.000,Emergent Literacy in Bilingual Early Childhood Education,"[{'days': 'MW', 'times': '0430pm-0830pm', 'dates': '07/29-08/07', 'location': 'MCA 102'}, {'days': 'F', 'times': '0900am-0400pm', 'dates': '08/02-08/02', 'location': 'MCA 102'}, {'days': 'S', 'times': 'TBA', 'dates': '08/03-08/03', 'location': 'ONLINE '}]","['MW 0430pm-0830pm 07/29-08/07 MCA 102', 'F 0900am-0400pm 08/02-08/02 MCA 102', 'F 0900am-0400pm 08/02-08/02 MCA 102', 'S TBA 08/03-08/03 ONLINE ', 'S TBA 08/03-08/03 ONLINE ']",Heather R.  Pellicone,Heather R.  Pellicone (P),20,7,13
